id,product_name,brand,price_inr,rating,review_count,category,source,link,merchant,battery_life_hrs,active_noise_cancellation,driver_size_mm,bluetooth_version,mic_count,ipx_rating,has_noise_cancellation,enhanced_at,ipx_level,has_usb_c,has_premium_codec,has_touch_control,has_voice_assistant,has_fast_charge,has_dual_pairing,anc_db,latency_ms,country_of_origin,charging_time_hrs,range_m,eq_modes,has_enc,has_gaming_mode,has_hi_res_audio,has_spatial_audio,has_low_latency,has_ipx,asin,parent_company,why_buy
1.0,"Boat Nirvana Ion, 120HRS Battery, Crystal Bionic Sound w/Dual EQ Modes, 4Mics ENx, App Support, Low Latency, IPX4, v.5.2 Bluetooth Earbuds, TWS Ear Buds Wireless Earphones with mic (Charcoal Black)",Boat,1599.0,4.1,13140.0,true wireless earbuds,enhanced_scrape,https://www.amazon.in/sspa/click?ie=UTF8&spc=MTo4MDM5MDkxODI1MDI1ODMwOjE3NzY5MTk0ODc6c3BfYXRmOjMwMDA2NDIwMzI3NjczMjo6MDo6&url=%2FboAt-Nirvana-Technology-Detection-Bluetooth%2Fdp%2FB0BW8TXJJ2%2Fref%3Dsr_1_1_sspa%3Fdib%3DeyJ2IjoiMSJ9.xWtvjmHNzFIjPnCtqXQpBq0UxRsgPU2XpvgJips6Y0kqldyiVj1gJ0wfIdIHhp4nFRXxxixsOIrZKZV7I5gAy39Nu59ZVdqVWUzFrN0BF3MR4AzOp4PpCIZR_0geY85-b4Nr2a4fUopYwq0T2UFYsNNWu5gHsyefeOebFbHQrjBMqVZQlH_GEqKUqGg8VdGyK3S0BspF2IrHtpYQ0DN1j4_ru95OS_uQgKOTZHqsHRY.QiVk3297qkjoR2m_IWrOFpJrueOOGQ006IR9Aa26lzA%26dib_tag%3Dse%26keywords%3Dwireless%2Bbluetooth%2Bearphones%26qid%3D1776919486%26sr%3D8-1-spons%26aref%3DpP7qowSQ6t%26sp_csd%3Dd2lkZ2V0TmFtZT1zcF9hdGY%26psc%3D1&aref=pP7qowSQ6t&sp_cr=ZAZ,,120.0,,,,4.0,IPX4,0.0,2026-04-23T12:23:58.203527,4.0,0.0,0.0,0.0,0.0,0.0,0.0,,,India,,,,1,0,0,0,0,,B0BW8TXJJ2,Imagine Marketing Ltd,"Exceptional 120H battery — great for all-day use | IP4 water resistance — safe for workouts and rain | 4-mic array with ENC for crystal-clear calls | Well-rated at 4.1/5 stars | Trusted by 13,140+ buyers"
2.0,"Boat Airdopes 219, 4Mics ENx, 40H Battery, Best in Segment for Calling, Stream Ad Free Music via App Support, Bluetooth Earbuds, TWS Ear Buds Wireless Earphones with mic (Forest Sage)",Boat,1099.0,3.9,4363.0,true wireless earbuds,enhanced_scrape,https://www.amazon.in/sspa/click?ie=UTF8&spc=MTo4MDM5MDkxODI1MDI1ODMwOjE3NzY5MTk0ODc6c3BfYXRmOjMwMDY0NzMxNjA5NjAzMjo6MDo6&url=%2FboAt-Airdopes-Bluetooth-Wireless-Earphones%2Fdp%2FB0FC2YFSN4%2Fref%3Dsr_1_2_sspa%3Fdib%3DeyJ2IjoiMSJ9.xWtvjmHNzFIjPnCtqXQpBq0UxRsgPU2XpvgJips6Y0kqldyiVj1gJ0wfIdIHhp4nFRXxxixsOIrZKZV7I5gAy39Nu59ZVdqVWUzFrN0BF3MR4AzOp4PpCIZR_0geY85-b4Nr2a4fUopYwq0T2UFYsNNWu5gHsyefeOebFbHQrjBMqVZQlH_GEqKUqGg8VdGyK3S0BspF2IrHtpYQ0DN1j4_ru95OS_uQgKOTZHqsHRY.QiVk3297qkjoR2m_IWrOFpJrueOOGQ006IR9Aa26lzA%26dib_tag%3Dse%26keywords%3Dwireless%2Bbluetooth%2Bearphones%26qid%3D1776919486%26sr%3D8-2-spons%26aref%3DIzBZ6NyydZ%26sp_csd%3Dd2lkZ2V0TmFtZT1zcF9hdGY%26psc%3D1&aref=IzBZ6NyydZ&sp_cr=ZAZ,,40.0,,,,4.0,,0.0,2026-04-23T12:23:58.203527,,0.0,0.0,0.0,0.0,0.0,0.0,,,India,,,,0,0,0,0,0,,B0FC2YFSN4,Imagine Marketing Ltd,"Long 40H battery life for extended listening | 4-mic array with ENC for crystal-clear calls | Popular choice with 4,363+ reviews"
3.0,Amazon Basics Pro Series Wireless Noise Cancelling ANC Over Ear Headphone | Bluetooth Headset | USB Charging | 10 m Paring Distance | 74 Hours Battery,Amazon Basics Pro Series Wireless Noise Cancelling ANC Over Ear Headphone,1859.0,,,over-ear headphone,enhanced_scrape,,Amazon.in,74.0,,,,,,1.0,2026-04-23T12:23:58.203527,,0.0,0.0,0.0,0.0,0.0,0.0,,,,,,,0,0,0,0,0,,,,
4.0,OnePlus Nord Buds 3r,OnePlus Nord Buds,799.0,4.6,240.0,true wireless earbuds,enhanced_scrape,,Amazon.in,,,,,,,0.0,2026-04-23T12:23:58.203527,,0.0,0.0,0.0,0.0,0.0,0.0,,,,,,,0,0,0,0,0,,,,
5.0,"Amazon Basics Pro Series ANC Over Ear Wireless Headphones, ANC (Up to 33 dB), Bluetooth 5.3, 28 Hr Playtime, 40mm Drivers, Comfort Fit with USB-C Fast",Amazon Basics Pro Series ANC Over Ear Wireless Headphones,1609.0,,,over-ear headphone,enhanced_scrape,,Amazon.in,28.0,,40.0,5.3,,,1.0,2026-04-23T12:23:58.203527,,1.0,0.0,0.0,0.0,0.0,0.0,,,,,,,0,0,0,0,0,,,,
6.0,iQOO TWS 1e In-Ear Earbuds,iQOO TWS,1899.0,,,true wireless earbuds,enhanced_scrape,,Amazon.in,,,,,,,0.0,2026-04-23T12:23:58.203527,,0.0,0.0,0.0,0.0,0.0,0.0,,,,,,,0,0,0,0,0,,,,
7.0,Amazon Basics Pro Series Wireless Noise Cancelling ANC Over Ear Headphone | Bluetooth Headset,Amazon Basics Pro Series Wireless Noise Cancelling ANC Over Ear Headphone,1999.0,,,over-ear headphone,enhanced_scrape,,addmecart,,,,,,,1.0,2026-04-23T12:23:58.203527,,0.0,0.0,0.0,0.0,0.0,0.0,,,,,,,0,0,0,0,0,,,,
8.0,boAt Airdopes 219 Wireless Earbuds,boAt Airdopes,1099.0,4.5,45.0,true wireless earbuds,enhanced_scrape,,Amazon.in,,,,,,,0.0,2026-04-23T12:23:58.203527,,0.0,0.0,0.0,0.0,0.0,0.0,,,,,,,0,0,0,0,0,,,,
9.0,Portronics Muffs M5 Over Ear Hybrid ANC Bluetooth Headphone,Portronics Muffs M,2249.0,,,over-ear headphone,enhanced_scrape,,Amazon.in,,,,,,,1.0,2026-04-23T12:23:58.203527,,0.0,0.0,0.0,0.0,0.0,0.0,,,,,,,0,0,0,0,0,,,,
10.0,boAt Rockerz 512 ANC 40dB Hybrid ANC 80H Battery,boAt Rockerz,2799.0,4.2,28.0,over-ear headphone,enhanced_scrape,,boAt,80.0,,,,,,1.0,2026-04-23T12:23:58.203527,,0.0,0.0,0.0,0.0,0.0,0.0,40.0,,,,,,0,0,0,0,0,,,,
11.0,HAmmer Splendor in Ear Bluetooth Neckband,HAmmer Splendor in Ear Bluetooth Neckband,379.0,3.5,34.0,neckband,enhanced_scrape,,Amazon.in,,,,,,,0.0,2026-04-23T12:23:58.203527,,0.0,0.0,0.0,0.0,0.0,0.0,,,,,,,0,0,0,0,0,,,,
12.0,Noise Airwave Max XR ANC Headphones,Noise Airwave Max XR ANC Headphones,2999.0,4.9,38.0,over-ear headphone,enhanced_scrape,,Amazon.in,,,,,,,1.0,2026-04-23T12:23:58.203527,,0.0,0.0,0.0,0.0,0.0,0.0,,,,,,,0,0,0,0,0,,,,
13.0,Sony WH-XB900N Wireless Noise Cancelling Headphones,Sony WH,18900.0,4.6,1400.0,over-ear headphone,enhanced_scrape,,Unboxify,,,,,,,1.0,2026-04-23T12:23:58.203527,,0.0,0.0,0.0,0.0,0.0,0.0,,,,,,,0,0,0,0,0,,,,
14.0,Noise Buds VS601 Truly Wireless Earbuds,Noise Buds VS,1399.0,4.8,7.0,true wireless earbuds,enhanced_scrape,,amazon.in,,,,,,,0.0,2026-04-23T12:23:58.203527,,0.0,0.0,0.0,0.0,0.0,0.0,,,,,,,0,0,0,0,0,,,,
15.0,Zebronics Duke Plus Wireless Headphone,Zebronics Duke Plus Wireless Headphone,1499.0,5.0,1.0,over-ear headphone,enhanced_scrape,,amazon.in,,,,,,,0.0,2026-04-23T12:23:58.203527,,0.0,0.0,0.0,0.0,0.0,0.0,,,,,,,0,0,0,0,0,,,,
16.0,Realme Buds Wireless 3 Neo Neckband,Realme Buds Wireless,999.0,4.5,1400.0,neckband,enhanced_scrape,,Amazon.in,,,,,,,0.0,2026-04-23T12:23:58.203527,,0.0,0.0,0.0,0.0,0.0,0.0,,,,,,,0,0,0,0,0,,,,
17.0,JBL Tune 770NC Wireless Noise Cancelling Over-Ear Headphones,JBL Tune,3599.0,4.5,7700.0,over-ear headphone,enhanced_scrape,,addmecart,,,,,,,1.0,2026-04-23T12:23:58.203527,,0.0,0.0,0.0,0.0,0.0,0.0,,,,,,,0,0,0,0,0,,,,
18.0,pTron Bassbuds Eon in-Ear TWS Earbuds,pTron Bassbuds Eon in,599.0,,,true wireless earbuds,enhanced_scrape,,Amazon.in,,,,,,,0.0,2026-04-23T12:23:58.203527,,0.0,0.0,0.0,0.0,0.0,0.0,,,,,,,0,0,0,0,0,,,,
19.0,boAt Rockerz 551 ANC Pro Bluetooth v5.4 Over Ear,boAt Rockerz,3799.0,4.1,9.0,over-ear headphone,enhanced_scrape,,Amazon.in,,,,5.4,,,1.0,2026-04-23T12:23:58.203527,,0.0,0.0,0.0,0.0,0.0,0.0,,,,,,,0,0,0,0,0,,,,
20.0,OnePlus Bullets Z2 Bluetooth Wireless in Ear Earphones with Mic,OnePlus Bullets Z,599.0,4.3,5800.0,neckband,enhanced_scrape,,amazon.in,,,,,,,0.0,2026-04-23T12:23:58.203527,,0.0,0.0,0.0,0.0,0.0,0.0,,,,,,,0,0,0,0,0,,,,
21.0,Skullcandy Hesh ANC Wireless Over-Ear Bluetooth Headphones Active Noise Cancelling,Skullcandy Hesh ANC Wireless Over,3799.0,4.4,3900.0,over-ear headphone,enhanced_scrape,,Unboxify,,,,,,,1.0,2026-04-23T12:23:58.203527,,0.0,0.0,0.0,0.0,0.0,0.0,,,,,,,0,0,0,0,0,,,,
22.0,"amazon basics True Wireless in-Ear Earbuds with Mic, Low-Latency Gaming Mode, Touch Control, IPX5 Water-Resistance, Bluetooth 5.3, Up to 60 Hours Play",amazon basics True Wireless in,499.0,,,true wireless earbuds,enhanced_scrape,,Banjara Electronics,60.0,,,5.3,,IPX5,1.0,2026-04-23T12:23:58.203527,5.0,0.0,0.0,1.0,0.0,0.0,0.0,,,,,,,0,0,0,0,0,,,,
23.0,GOBOult Q Over Ear Bluetooth Headphones,GOBOult Q Over Ear Bluetooth Headphones,1799.0,4.7,70.0,over-ear headphone,enhanced_scrape,,Amazon.in,,,,,,,0.0,2026-04-23T12:23:58.203527,,0.0,0.0,0.0,0.0,0.0,0.0,,,,,,,0,0,0,0,0,,,,
24.0,realme Buds T200 Lite Bluetooth in Ear Earbuds,realme Buds T,1199.0,4.8,1100.0,true wireless earbuds,enhanced_scrape,,Amazon.in,,,,,,,0.0,2026-04-23T12:23:58.203527,,0.0,0.0,0.0,0.0,0.0,0.0,,,,,,,0,0,0,0,0,,,,
25.0,Airwave Max 4 Wireless Headphone,Airwave Max,1699.0,4.4,243.0,over-ear headphone,enhanced_scrape,,Zepto,,,,,,,0.0,2026-04-23T12:23:58.203527,,0.0,0.0,0.0,0.0,0.0,0.0,,,,,,,0,0,0,0,0,,,,
26.0,OnePlus Bullets Z2 ANC Wireless Bluetooth Neckband with Mic,OnePlus Bullets Z,999.0,4.2,1800.0,neckband,enhanced_scrape,,amazon.in,,,,,,,1.0,2026-04-23T12:23:58.203527,,0.0,0.0,0.0,0.0,0.0,0.0,,,,,,,0,0,0,0,0,,,,
27.0,GOBOult Soniq Over Ear Bluetooth Headphones,GOBOult Soniq Over Ear Bluetooth Headphones,1999.0,,,over-ear headphone,enhanced_scrape,,Amazon.in,,,,,,,0.0,2026-04-23T12:23:58.203527,,0.0,0.0,0.0,0.0,0.0,0.0,,,,,,,0,0,0,0,0,,,,
28.0,Boult Audio Z60 True Wireless In Ear Earbuds,Boult Audio Z,899.0,4.3,126.0,true wireless earbuds,enhanced_scrape,,Amazon.in,,,,,,,0.0,2026-04-23T12:23:58.203527,,0.0,0.0,0.0,0.0,0.0,0.0,,,,,,,0,0,0,0,0,,,,
29.0,Amazon basics Over Ear Headphones,Amazon basics Over Ear Headphones,1099.0,,,over-ear headphone,enhanced_scrape,,Shopy Vision,,,,,,,0.0,2026-04-23T12:23:58.203527,,0.0,0.0,0.0,0.0,0.0,0.0,,,,,,,0,0,0,0,0,,,,
30.0,PTron Studio Evo 70hrs Playtime Wireless Over Ear Headphones,PTron Studio Evo,798.0,,,over-ear headphone,enhanced_scrape,,Amazon.in,70.0,,,,,,0.0,2026-04-23T12:23:58.203527,,0.0,0.0,0.0,0.0,0.0,0.0,,,,,,,0,0,0,0,0,,,,
31.0,Kratos N1 Neckband Bluetooth Headphones,Kratos N,398.0,,,neckband,enhanced_scrape,,Amazon.in,,,,,,,0.0,2026-04-23T12:23:58.203527,,0.0,0.0,0.0,0.0,0.0,0.0,,,,,,,0,0,0,0,0,,,,
32.0,Marshall Monitor III Active Noise Cancelling Over-Ear Bluetooth Headphones,Marshall Monitor III Active Noise Cancelling Over,29999.0,4.8,607.0,over-ear headphone,enhanced_scrape,,Vijay Sales,,,,,,,1.0,2026-04-23T12:23:58.203527,,0.0,0.0,0.0,0.0,0.0,0.0,,,,,,,0,0,0,0,0,,,,
33.0,Noise Buds VS104 Truly Wireless Earbuds,Noise Buds VS,899.0,4.6,945.0,true wireless earbuds,enhanced_scrape,,Amazon.in,,,,,,,0.0,2026-04-23T12:23:58.203527,,0.0,0.0,0.0,0.0,0.0,0.0,,,,,,,0,0,0,0,0,,,,
34.0,Noise Airwave Max 3 Wireless Headphone,Noise Airwave Max,1699.0,4.3,86.0,over-ear headphone,enhanced_scrape,,Amazon.in,,,,,,,0.0,2026-04-23T12:23:58.203527,,0.0,0.0,0.0,0.0,0.0,0.0,,,,,,,0,0,0,0,0,,,,
35.0,Realme Buds Wireless 3 Neckband,Realme Buds Wireless,499.0,4.5,1900.0,neckband,enhanced_scrape,,amazon.in,,,,,,,0.0,2026-04-23T12:23:58.203527,,0.0,0.0,0.0,0.0,0.0,0.0,,,,,,,0,0,0,0,0,,,,
36.0,boAt Rockerz Plus 550 Wireless Headphones,boAt Rockerz Plus,1899.0,4.4,8.0,over-ear headphone,enhanced_scrape,,boAt,,,,,,,0.0,2026-04-23T12:23:58.203527,,0.0,0.0,0.0,0.0,0.0,0.0,,,,,,,0,0,0,0,0,,,,
37.0,Boult Audio AirBass Y1 TWS Earbuds,Boult Audio AirBass Y,699.0,4.1,809.0,true wireless earbuds,enhanced_scrape,,Amazon.in,,,,,,,0.0,2026-04-23T12:23:58.203527,,0.0,0.0,0.0,0.0,0.0,0.0,,,,,,,0,0,0,0,0,,,,
38.0,Edifier W820NB Plus Wireless Noise Cancellation Over-Ear Headphones,Edifier W,8490.0,4.8,7600.0,over-ear headphone,enhanced_scrape,,Amazon.in,,,,,,,1.0,2026-04-23T12:23:58.203527,,0.0,0.0,0.0,0.0,0.0,0.0,,,,,,,0,0,0,0,0,,,,
39.0,"Amazon Basics in-Ear Bluetooth 5.0 Neckband with Up to 30 Hours Playtime, with Mic, Magnetic Earbuds, Voice Assistant, Dual Pairing and IPX6 Rated",Amazon Basics in,584.0,,,neckband,enhanced_scrape,,Banjara Electronics,30.0,,,5.0,,IPX6,0.0,2026-04-23T12:23:58.203527,6.0,0.0,0.0,0.0,1.0,0.0,0.0,,,,,,,0,0,0,0,0,,,,
40.0,GOBOult Anchor Bluetooth Wireless Over Ear Headphones,GOBOult Anchor Bluetooth Wireless Over Ear Headphones,2499.0,4.3,3.0,over-ear headphone,enhanced_scrape,,Myntra,,,,,,,1.0,2026-04-23T12:23:58.203527,,0.0,0.0,0.0,0.0,0.0,0.0,,,,,,,0,0,0,0,0,,,,
41.0,Kratos Cube Wireless Ear Buds,Kratos Cube Wireless Ear Buds,499.0,,,true wireless earbuds,enhanced_scrape,,Amazon.in,,,,,,,0.0,2026-04-23T12:23:58.203527,,0.0,0.0,0.0,0.0,0.0,0.0,,,,,,,0,0,0,0,0,,,,
42.0,LifeCon Wireless Bluetooth Headphones,LifeCon Wireless Bluetooth Headphones,10887.0,4.2,12.0,over-ear headphone,enhanced_scrape,,amazon.in,,,,,,,0.0,2026-04-23T12:23:58.203527,,0.0,0.0,0.0,0.0,0.0,0.0,,,,,,,0,0,0,0,0,,,,
43.0,Realme Buds T200x TWS Earbuds,Realme Buds T,1399.0,4.3,324.0,true wireless earbuds,enhanced_scrape,,Amazon.in,,,,,,,0.0,2026-04-23T12:23:58.203527,,0.0,0.0,0.0,0.0,0.0,0.0,,,,,,,0,0,0,0,0,,,,
44.0,Portronics Muffs M3 Over-Ear Headphones,Portronics Muffs M,1605.0,4.7,3.0,over-ear headphone,enhanced_scrape,,JioMart Marketplace,,,,,,,0.0,2026-04-23T12:23:58.203527,,0.0,0.0,0.0,0.0,0.0,0.0,,,,,,,0,0,0,0,0,,,,
45.0,Portronics Twins S18 Pro TWS Earbuds,Portronics Twins S,699.0,,,true wireless earbuds,enhanced_scrape,,Amazon.in,,,,,,,0.0,2026-04-23T12:23:58.203527,,0.0,0.0,0.0,0.0,0.0,0.0,,,,,,,0,0,0,0,0,,,,
46.0,JLab JBuds LUX ANC Active Noise Cancelling,JLab JBuds LUX ANC Active Noise Cancelling,5999.0,4.6,5800.0,over-ear headphone,enhanced_scrape,,Amazon.in,,,,,,,1.0,2026-04-23T12:23:58.203527,,0.0,0.0,0.0,0.0,0.0,0.0,,,,,,,0,0,0,0,0,,,,
47.0,,Realme,2854.0,3.8,306601.0,true wireless earbuds,enhanced_scrape,,,35.0,0.0,14.2,5.2,,,,2026-04-23T12:23:58.203527,,,,,,,,,,,,,,0,0,0,0,0,,,,
,"Fire-Boltt Aero TWS Earbuds, Custom EQ Profiles, 50H Ba...",Fire-Boltt,799.0,3.9,0.0,true wireless earbuds,enhanced_scrape,,,50.0,,,,,,0.0,2026-04-23T12:23:58.203527,,0.0,0.0,0.0,0.0,0.0,0.0,,,,,,,0,0,0,0,0,,,,
,Aroma NB121 Pods Upto 40 Hours Playtime* Type C Fast Ch...,Aroma,259.0,3.5,0.0,unknown,enhanced_scrape,,,40.0,,,,,,0.0,2026-04-23T12:23:58.203527,,0.0,0.0,0.0,0.0,0.0,0.0,,,,,,,0,0,0,0,0,,,,
,Aroma NB119 Pro Belief Upto 48H Playtime* Fast Charging...,Aroma,239.0,3.6,0.0,unknown,enhanced_scrape,,,48.0,,,,,,0.0,2026-04-23T12:23:58.203527,,0.0,0.0,0.0,0.0,0.0,0.0,,,,,,,0,0,0,0,0,,,,
,FRONY AE-1017 P47 Headset Super Extra Bass Bluetooth He...,FRONY,297.0,3.1,0.0,over-ear headphone,enhanced_scrape,,,47.0,,,,,,0.0,2026-04-23T12:23:58.203527,,0.0,0.0,0.0,0.0,0.0,0.0,,,,,,,0,0,0,0,0,,,,
,TECHIO BS ultrapood Bluetooth,TECHIO,251.0,3.5,0.0,unknown,enhanced_scrape,,,,,,,,,0.0,2026-04-23T12:23:58.203527,,0.0,0.0,0.0,0.0,0.0,0.0,,,,,,,0,0,0,0,0,,,,
,"shopbucket Wireless Bluetooth 5.3 Neckband, 40H Playtim...",shopbucket,365.0,5.0,0.0,neckband,enhanced_scrape,,,40.0,,,5.3,,,0.0,2026-04-23T12:23:58.203527,,0.0,0.0,0.0,0.0,0.0,0.0,,,,,,,0,0,0,0,0,,,,
,TECHIO Black Earbuds | True Wireless Stereo | Noise Can...,TECHIO,265.0,3.6,0.0,true wireless earbuds,enhanced_scrape,,,,,,,,,0.0,2026-04-23T12:23:58.203527,,0.0,0.0,0.0,0.0,0.0,0.0,,,,,,,0,0,0,0,0,,,,
,"TWS Foldable Hi-Fi Headphones with Mic & SD Card, Stron...",TWS,412.0,4.0,0.0,true wireless earbuds,enhanced_scrape,,,,,,,,,0.0,2026-04-23T12:23:58.203527,,0.0,0.0,0.0,0.0,0.0,0.0,,,,,,,0,0,0,0,0,,,,
,FITRIC Upgraded Latest Wireless Stylish Neckband With D...,FITRIC,282.0,3.8,0.0,neckband,enhanced_scrape,,,,,,,,,0.0,2026-04-23T12:23:58.203527,,0.0,0.0,0.0,0.0,0.0,0.0,,,,,,,0,0,0,0,0,,,,
,GREE MATT 3 Days Backup Powerfull Bluetooth,GREE,418.0,4.0,0.0,unknown,enhanced_scrape,,,,,,,,,0.0,2026-04-23T12:23:58.203527,,0.0,0.0,0.0,0.0,0.0,0.0,,,,,,,0,0,0,0,0,,,,
,"Aroma NB119 Titanium Upto 48Hr Playtime*, Fast Charging...",Aroma,289.0,4.0,0.0,unknown,enhanced_scrape,,,48.0,,,,,,0.0,2026-04-23T12:23:58.203527,,0.0,0.0,0.0,0.0,0.0,0.0,,,,,,,0,0,0,0,0,,,,
,Aroma NB119B Badshah - 40 Hours Playtime Neckband Bluet...,Aroma,229.0,3.9,0.0,neckband,enhanced_scrape,,,40.0,,,,,,0.0,2026-04-23T12:23:58.203527,,0.0,0.0,0.0,0.0,0.0,0.0,,,,,,,0,0,0,0,0,,,,
,"GREE MATT MN2 40Hour Backup,Extra Bass,Waterproof Neckb...",GREE,418.0,3.7,0.0,unknown,enhanced_scrape,,,40.0,,,,,,0.0,2026-04-23T12:23:58.203527,,0.0,0.0,0.0,0.0,0.0,0.0,,,,,,,0,0,0,0,0,,,,
,Worricow BRANDED Wireless Bluetooth Portable Sports Hea...,Worricow,297.0,3.2,0.0,unknown,enhanced_scrape,,,,,,,,,0.0,2026-04-23T12:23:58.203527,,0.0,0.0,0.0,0.0,0.0,0.0,,,,,,,0,0,0,0,0,,,,
,FRONY MW-139 SH12 Headset Super Extra Bass Bluetooth He...,FRONY,459.0,3.4,0.0,over-ear headphone,enhanced_scrape,,,12.0,,,,,,0.0,2026-04-23T12:23:58.203527,,0.0,0.0,0.0,0.0,0.0,0.0,,,,,,,0,0,0,0,0,,,,
,FRONY EQ-1033 P47 Headset Super Extra Bass Bluetooth He...,FRONY,294.0,3.6,0.0,over-ear headphone,enhanced_scrape,,,47.0,,,,,,0.0,2026-04-23T12:23:58.203527,,0.0,0.0,0.0,0.0,0.0,0.0,,,,,,,0,0,0,0,0,,,,
,"Noise Buds UNO, 40Hrs Playtime, Quad Mic with ENC, Prem...",Noise,1099.0,4.1,0.0,unknown,enhanced_scrape,,,40.0,,,,,,0.0,2026-04-23T12:23:58.203527,,0.0,0.0,0.0,0.0,0.0,0.0,,,,,,,0,0,0,0,0,,,,
,"Aroma NB120 Amaze Upto 50 Hrs* Playtime, Dual Pairing F...",Aroma,260.0,3.7,0.0,unknown,enhanced_scrape,,,50.0,,,,,,0.0,2026-04-23T12:23:58.203527,,0.0,0.0,0.0,0.0,0.0,0.0,,,,,,,0,0,0,0,0,,,,
,GUGGU MW-139 SH12 Headset Super Extra Bass Bluetooth He...,GUGGU,461.0,3.9,0.0,over-ear headphone,enhanced_scrape,,,12.0,,,,,,0.0,2026-04-23T12:23:58.203527,,0.0,0.0,0.0,0.0,0.0,0.0,,,,,,,0,0,0,0,0,,,,
,Aroma NB120 Electro Buds Wireless 2 Neo 50Hrs Playtime*...,Aroma,259.0,3.9,0.0,unknown,enhanced_scrape,,,50.0,,,,,,0.0,2026-04-23T12:23:58.203527,,0.0,0.0,0.0,0.0,0.0,0.0,,,,,,,0,0,0,0,0,,,,
,FRONY NH-219 SH12 Headset Super Extra Bass Bluetooth He...,FRONY,455.0,3.3,0.0,over-ear headphone,enhanced_scrape,,,12.0,,,,,,0.0,2026-04-23T12:23:58.203527,,0.0,0.0,0.0,0.0,0.0,0.0,,,,,,,0,0,0,0,0,,,,
,FRONY NR-251 SH12 Headset Super Extra Bass Bluetooth He...,FRONY,451.0,3.0,0.0,over-ear headphone,enhanced_scrape,,,12.0,,,,,,0.0,2026-04-23T12:23:58.203527,,0.0,0.0,0.0,0.0,0.0,0.0,,,,,,,0,0,0,0,0,,,,
,ROAR HB-153 Headset Super Extra Bass Bluetooth Headset ...,ROAR,473.0,3.0,0.0,over-ear headphone,enhanced_scrape,,,153.0,,,,,,0.0,2026-04-23T12:23:58.203527,,0.0,0.0,0.0,0.0,0.0,0.0,,,,,,,0,0,0,0,0,,,,
,FRONY OS-845 P47 Headset Super Extra Bass Bluetooth Hea...,FRONY,331.0,4.5,0.0,over-ear headphone,enhanced_scrape,,,47.0,,,,,,0.0,2026-04-23T12:23:58.203527,,0.0,0.0,0.0,0.0,0.0,0.0,,,,,,,0,0,0,0,0,,,,
,Aroma NB126 Aster V5.4 Upto 50Hr Playtime* 45Ms Latency...,Aroma,469.0,3.8,0.0,unknown,enhanced_scrape,,,50.0,,,,,,0.0,2026-04-23T12:23:58.203527,,0.0,0.0,0.0,0.0,0.0,0.0,,45.0,,,,,0,0,0,0,0,,,,
,Aroma NB119 Titanium - 48 Hours Playtime Bluetooth Neck...,Aroma,289.0,4.0,0.0,unknown,enhanced_scrape,,,48.0,,,,,,0.0,2026-04-23T12:23:58.203527,,0.0,0.0,0.0,0.0,0.0,0.0,,,,,,,0,0,0,0,0,,,,
,FRONY WK-854 P47 Headset Super Extra Bass Bluetooth Hea...,FRONY,297.0,3.5,0.0,over-ear headphone,enhanced_scrape,,,47.0,,,,,,0.0,2026-04-23T12:23:58.203527,,0.0,0.0,0.0,0.0,0.0,0.0,,,,,,,0,0,0,0,0,,,,
,FRONY WI-981 P47 Headset Super Extra Bass Bluetooth Hea...,FRONY,337.0,3.7,0.0,over-ear headphone,enhanced_scrape,,,47.0,,,,,,0.0,2026-04-23T12:23:58.203527,,0.0,0.0,0.0,0.0,0.0,0.0,,,,,,,0,0,0,0,0,,,,
,"HOPPUP S40 Earbuds with 13MM Drivers, 40H Playtime, Rag...",HOPPUP,599.0,4.1,0.0,true wireless earbuds,enhanced_scrape,,,40.0,,13.0,,,,0.0,2026-04-23T12:23:58.203527,,0.0,0.0,0.0,0.0,0.0,0.0,,,,,,,0,0,0,0,0,,,,
,"Aroma NB120 Amaze Upto 50 Hours Playtime*, Fast Chargin...",Aroma,300.0,3.7,0.0,unknown,enhanced_scrape,,,50.0,,,,,,0.0,2026-04-23T12:23:58.203527,,0.0,0.0,0.0,0.0,0.0,0.0,,,,,,,0,0,0,0,0,,,,
,Aroma NB119 Genius Upto 60 Hours Playtime* Dual Pairing...,Aroma,235.0,3.7,0.0,unknown,enhanced_scrape,,,60.0,,,,,,0.0,2026-04-23T12:23:58.203527,,0.0,0.0,0.0,0.0,0.0,0.0,,,,,,,0,0,0,0,0,,,,
,Aroma NB121 Corridor Upto 40 Hours Playtime* Fast Charg...,Aroma,225.0,3.9,0.0,unknown,enhanced_scrape,,,40.0,,,,,,0.0,2026-04-23T12:23:58.203527,,0.0,0.0,0.0,0.0,1.0,0.0,,,,,,,0,0,0,0,0,,,,
,"ACwO Dwots Bold Wireless in Ear Earbuds|India'S 1St Smart 1.83"" True HD Touch Display|ANC (32Db)|4 ENC Mics for Clear Calls|Find My Earphone|3D Spatial Sound|Quick Charge |60Hrs Playtime (Bold Black)",ACwO,2499.0,3.7,178.0,true wireless earbuds,enhanced_scrape,,,60.0,,,,,,1.0,,,0.0,0.0,0.0,0.0,0.0,0.0,,,India,,,,1,0,0,0,0,0.0,B0DTHPN47Z,ACwO Technologies,Exceptional 60H battery — great for all-day use | Active Noise Cancellation for immersive listening
,AROMA TWS1 Pulse V5.4 True Wireless Earbuds – Bluetooth Headphones with up to 60H Playtime | ENC | Fast Charging | Heavy Bass | Shiny Black,AROMA,499.0,5.0,4.0,true wireless earbuds,enhanced_scrape,,,60.0,,,,,,0.0,,,0.0,0.0,0.0,0.0,1.0,0.0,,,India,,,,1,0,0,0,0,0.0,B0GQZBDH3Y,Aroma India,Exceptional 60H battery — great for all-day use | Fast charging — minimal downtime between uses | Highly rated 5.0/5 by customers
,AROMA NB124 Cosmo Wireless Neckband Bluetooth Headphones – up to 100H Playtime | ENC | Voice Changer | Fast Charging | Midnight Blue,AROMA,299.0,4.6,3.0,over-ear headphone,enhanced_scrape,,,100.0,,,,,,0.0,,,0.0,0.0,0.0,0.0,1.0,0.0,,,India,,,,1,0,0,0,0,0.0,B0GQZ8WQN9,Aroma India,Exceptional 100H battery — great for all-day use | Fast charging — minimal downtime between uses | Highly rated 4.6/5 by customers
,AlakhDM Wireless Earbuds Bluetooth 5.3 TWS Earphones Full Touch Control Headphones Built-in Microphone Premium Sound Quality Ensure Fast Stable & Connection With Type C Charger,AlakhDM,349.0,5.0,3.0,true wireless earbuds,enhanced_scrape,,,,,,5.3,,,0.0,,,0.0,0.0,1.0,0.0,0.0,0.0,,,China,,,,0,0,0,0,0,0.0,B0GX1SW3TJ,AlakhDM,"Latest Bluetooth v5.3 for stable, efficient connection | Highly rated 5.0/5 by customers"
,"Apritex Wireless Bluetooth 5.3 TWS Earbuds with Charging Case, Touch Control, Deep Bass Stereo Sound, Noise Reduction, Type-C Fast Charging.",Apritex,299.0,5.0,1.0,true wireless earbuds,enhanced_scrape,,,,,,5.3,,,0.0,,,0.0,0.0,1.0,0.0,1.0,0.0,,,China,,,,0,0,0,0,0,0.0,B0GWZQ6C54,Apritex,"Fast charging — minimal downtime between uses | Latest Bluetooth v5.3 for stable, efficient connection | Highly rated 5.0/5 by customers"
,Bluetooth Ear Buds with Fast Pairing Portable Charging Case Noise Isolation Mic for Calling Music Gaming (Design 299),Bluetooth,299.0,4.0,21.0,true wireless earbuds,enhanced_scrape,,,,,,,,,0.0,,,0.0,0.0,0.0,0.0,0.0,0.0,,,China,,,,0,1,0,0,0,0.0,B0GPJN68TV,Bluetooth,Well-rated at 4.0/5 stars
,"Boat Airdopes 800, Dolby Audio, Adaptive EQ by Mimi, 4Mics AI ENx, App Support, Fast Charge, IPX5, v5.3 Bluetooth TWS in Ear Earbuds Wireless Earphones with mic (Interstellar White)",Boat,1699.0,4.1,8908.0,true wireless earbuds,enhanced_scrape,,,,,,,4 mics,IPX5,0.0,,5.0,0.0,0.0,0.0,0.0,1.0,0.0,,,India,,,,0,0,0,0,0,1.0,B0D1V8CKFQ,Imagine Marketing Ltd,"Fast charging — minimal downtime between uses | IP5 water resistance — safe for workouts and rain | 4-mic array with ENC for crystal-clear calls | Well-rated at 4.1/5 stars | Popular choice with 8,908+ reviews"
,"Boat Rockerz 255 Pro+, 60HRS Battery, Fast Charge, IPX7, Dual Pairing, Low Latency, Magnetic Earbuds, in Ear Bluetooth Neckband, Wireless with Mic Earphones (Active Black)",Boat,1049.0,4.0,148496.0,true wireless earbuds,enhanced_scrape,,,60.0,,,,,IPX7,0.0,,7.0,0.0,0.0,0.0,0.0,1.0,1.0,,,India,,,,1,0,0,0,0,1.0,B08TV2P1N8,Imagine Marketing Ltd,"Exceptional 60H battery — great for all-day use | Fast charging — minimal downtime between uses | IP7 water resistance — safe for workouts and rain | Multipoint connection — pair with two devices simultaneously | Well-rated at 4.0/5 stars | Trusted by 148,496+ buyers"
,"Boat Rockerz 113, 40H Battery, Dual Pair, Fast Charge, ENx Tech, Stream Ad Free Music via App Support, Magnetic Buds, Bluetooth Neckband, Wireless with Mic in Ear Earphones (Active Black)",Boat,899.0,4.0,9035.0,neckband,enhanced_scrape,,,40.0,,,,,,0.0,,,0.0,0.0,0.0,0.0,1.0,1.0,,,India,,,,0,0,0,0,0,0.0,B0F7Y54PJX,Imagine Marketing Ltd,"Long 40H battery life for extended listening | Fast charging — minimal downtime between uses | Well-rated at 4.0/5 stars | Popular choice with 9,035+ reviews"
,"Boat Rockerz 235 Pro Wireless Bluetooth Neckband in Ear Earphone, Upto 20 hrs of Playtime, Beast Mode, Low Latency, IPX5 Water & Sweat Resistance, ENx Technology, Bluetooth v5.2(Active Black)",Boat,999.0,4.0,2653.0,neckband,enhanced_scrape,,,20.0,,,5.2,,IPX5,1.0,,5.0,0.0,0.0,0.0,0.0,0.0,0.0,,,India,,,,1,1,0,0,0,1.0,B0CP3N5F5B,Imagine Marketing Ltd,"Decent 20H playtime for daily commutes | Active Noise Cancellation for immersive listening | IP5 water resistance — safe for workouts and rain | Well-rated at 4.0/5 stars | Popular choice with 2,653+ reviews"
,"Boat Airdopes 300, Cinematic Spatial Audio, 50H Battery, 4Mic AI ENx, Fast Charge, App Support, Low Latency, IPX4, v5.3 Bluetooth Earbuds, TWS in Ear Earbuds Wireless Earphones with mic (Purple Haze)",Boat,1399.0,4.0,9418.0,true wireless earbuds,enhanced_scrape,,,50.0,,,,4 mics,IPX4,0.0,,4.0,0.0,0.0,0.0,0.0,1.0,0.0,,,India,,,,1,0,0,1,0,1.0,B0D3LBFX1W,Imagine Marketing Ltd,"Long 50H battery life for extended listening | Fast charging — minimal downtime between uses | Spatial/3D audio for an immersive sound experience | IP4 water resistance — safe for workouts and rain | 4-mic array with ENC for crystal-clear calls | Well-rated at 4.0/5 stars | Popular choice with 9,418+ reviews"
,"Boat Rockerz Prime 255Z, Spatial Audio,ENx Tech, Dual Pair, 50H Battery, Stream Ad Free Music via App Support, Magnetic Buds, Bluetooth Neckband, Wireless with Mic Earphones (Onyx Black)",Boat,1199.0,4.0,66238.0,neckband,enhanced_scrape,,,50.0,,,,,,0.0,,,0.0,0.0,0.0,0.0,0.0,1.0,,,India,,,,0,0,0,1,0,0.0,B0FHHL4GC3,Imagine Marketing Ltd,"Long 50H battery life for extended listening | Spatial/3D audio for an immersive sound experience | Well-rated at 4.0/5 stars | Trusted by 66,238+ buyers"
