id,product_name,brand,price_inr,rating,review_count,category,source,link,merchant,battery_life_hrs,active_noise_cancellation,driver_size_mm,bluetooth_version,mic_count,ipx_rating,has_noise_cancellation,enhanced_at,ipx_level,has_usb_c,has_premium_codec,has_touch_control,has_voice_assistant,has_fast_charge,has_dual_pairing,anc_db,latency_ms,country_of_origin,charging_time_hrs,range_m,eq_modes,has_enc,has_gaming_mode,has_hi_res_audio,has_spatial_audio,has_low_latency,has_ipx,asin,parent_company,why_buy
,"Boat Nirvana Crystl, Transparent Case,Spatial Audio, ANC(~32dB), 100Hrs Battery,4Mics ENx,App Support, Bluetooth Earbuds, TWS Ear Buds Wireless Earphones with mic (Quantum Black)",Boat,1899.0,4.0,1817.0,true wireless earbuds,enhanced_scrape,,,100.0,,,,4 mics,,1.0,,,0.0,0.0,0.0,0.0,0.0,0.0,,,India,,,,0,0,0,1,0,0.0,B0DGTVRH97,Imagine Marketing Ltd,"Exceptional 100H battery — great for all-day use | Active Noise Cancellation for immersive listening | Spatial/3D audio for an immersive sound experience | 4-mic array with ENC for crystal-clear calls | Well-rated at 4.0/5 stars | Popular choice with 1,817+ reviews"
,"Boat Airdopes 219, 4Mics ENx, 40H Battery, Best in Segment for Calling, Stream Ad Free Music via App Support, Bluetooth Earbuds, TWS Ear Buds Wireless Earphones with mic (Ivory Mist)",Boat,1099.0,3.9,4363.0,true wireless earbuds,enhanced_scrape,,,40.0,,,,4 mics,,0.0,,,0.0,0.0,0.0,0.0,0.0,0.0,,,India,,,,0,0,0,0,0,0.0,B0FC2Z19RX,Imagine Marketing Ltd,"Long 40H battery life for extended listening | 4-mic array with ENC for crystal-clear calls | Popular choice with 4,363+ reviews"
,"Boat Rockerz 245 v2 Pro, 30h Battery, ENx Tech, Fast Charge, Dual Pairing, Magnetic Buds, USB Type-C Interface & IPX5, Bluetooth in Ear Neckband, Wireless with Mic Earphones (Teal Green)",Boat,999.0,3.9,121282.0,neckband,enhanced_scrape,,,30.0,,,,,IPX5,0.0,,5.0,1.0,0.0,0.0,0.0,1.0,1.0,,,India,,,,0,0,0,0,0,1.0,B0CC8SBFFR,Imagine Marketing Ltd,"Decent 30H playtime for daily commutes | Fast charging — minimal downtime between uses | IP5 water resistance — safe for workouts and rain | Multipoint connection — pair with two devices simultaneously | Trusted by 121,282+ buyers"
,"Boat Airdopes Prime 701 ANC, 46dB Hybrid ANC, 50Hr Battery, Real Spatial Audio,Multidevice Connect,App Support, Bluetooth Earbuds, TWS Ear Buds Wireless Earphones with mic (Obsidian Black)",Boat,1999.0,3.9,2924.0,true wireless earbuds,enhanced_scrape,,,50.0,,,,,,1.0,,,0.0,0.0,0.0,0.0,0.0,0.0,46.0,,India,,,,0,0,0,1,0,0.0,B0F8BVYRWS,Imagine Marketing Ltd,"Long 50H battery life for extended listening | Active Noise Cancellation (46db hybrid anc) blocks out distractions | Spatial/3D audio for an immersive sound experience | Popular choice with 2,924+ reviews"
,"Boat Airdopes 111v2, Premium Leather Finish, 4Mics ENx, 50HRS Battery, 13mm Drivers, Fast Charge, Dual Pair, v5.4 Bluetooth TWS in Ear Earbuds Wireless Earphones with mic (Classic Black)",Boat,1299.0,3.9,10682.0,true wireless earbuds,enhanced_scrape,,,50.0,,13.0,,4 mics,,0.0,,,0.0,0.0,0.0,0.0,1.0,1.0,,,India,,,,0,0,0,0,0,0.0,B0DPWJYQK1,Imagine Marketing Ltd,"Long 50H battery life for extended listening | Fast charging — minimal downtime between uses | 4-mic array with ENC for crystal-clear calls | 13mm driver for rich, detailed sound | Trusted by 10,682+ buyers"
,"Boat Nirvana Zenith Pro, 50dB Hybrid Adaptive ANC, Spatial Audio, Hi-Res Audio LDAC, 6Mics AI-ENx, 80 Hrs Battery, Bluetooth Earbuds, TWS Ear Buds Wireless Earphones with mic (Crimson Red)",Boat,2999.0,3.9,1503.0,true wireless earbuds,enhanced_scrape,,,80.0,,,,6 mics,,1.0,,,0.0,1.0,0.0,0.0,0.0,0.0,50.0,,India,,,,0,0,1,1,0,0.0,B0DXP8JM1M,Imagine Marketing Ltd,"Exceptional 80H battery — great for all-day use | Active Noise Cancellation (50db hybrid adaptive anc) blocks out distractions | Spatial/3D audio for an immersive sound experience | Hi-Res audio (LDAC/LHDC) for studio-quality sound | 6-mic array with ENC for crystal-clear calls | Popular choice with 1,503+ reviews"
,"Boat Airdopes Joy, 35Hrs Battery, Fast Charge, IWP Tech, Low Latency, 2Mic ENx, Type-C Port, v5.3 Bluetooth Earbuds, TWS Ear Buds Wireless Earphones with mic(Dark Cyan)",Boat,999.0,3.8,8765.0,true wireless earbuds,enhanced_scrape,,,35.0,,,,2 mics,,0.0,,,0.0,0.0,0.0,0.0,1.0,0.0,,,India,,,,1,0,0,0,0,0.0,B0C411BWXD,Imagine Marketing Ltd,"Decent 35H playtime for daily commutes | Fast charging — minimal downtime between uses | Built-in 2 mics for hands-free calling | Popular choice with 8,765+ reviews"
,"Boat Airdopes 131 Gen 2, 13mm Drivers, 70H Battery, ENx Tech, Beast Mode 45 ms Low Latency, ASAP Charge, Bluetooth Earbuds, TWS Ear Buds Wireless Earphones with mic (Carbon Black)",Boat,999.0,3.8,5632.0,true wireless earbuds,enhanced_scrape,,,70.0,,13.0,,,,0.0,,,0.0,0.0,0.0,0.0,1.0,0.0,,45.0,India,,,,1,1,0,0,1,0.0,B0FPLP7SMZ,Imagine Marketing Ltd,"Exceptional 70H battery — great for all-day use | Ultra-low 45ms latency — ideal for gaming and video | Fast charging — minimal downtime between uses | 13mm driver for rich, detailed sound | Popular choice with 5,632+ reviews"
,"Boat Airdopes 212, 50H Battery, ENx Tech, Beast Mode, ASAP Charge, Bluetooth Earbuds, TWS Ear Buds Wireless Earphones with mic (Ivory)",Boat,849.0,3.8,67.0,true wireless earbuds,enhanced_scrape,,,50.0,,,,,,0.0,,,0.0,0.0,0.0,0.0,1.0,0.0,,,India,,,,0,1,0,0,0,0.0,B0G48KJ7LJ,Imagine Marketing Ltd,Long 50H battery life for extended listening | Fast charging — minimal downtime between uses
,"Boat Rockerz 200, 40H Battery, Signature Sound, ENx Tech, Dual Pairing, 60 ms Low Latency, IPX5, ASAP Charge, Magnetic Buds, Bluetooth Neckband, Wireless with Mic Earphones (Active Black)",Boat,799.0,3.8,46.0,neckband,enhanced_scrape,,,40.0,,,,,IPX5,0.0,,5.0,0.0,0.0,0.0,0.0,1.0,1.0,,60.0,India,,,,1,0,0,0,1,1.0,B0G48M3KXD,Imagine Marketing Ltd,Long 40H battery life for extended listening | Fast charging — minimal downtime between uses | IP5 water resistance — safe for workouts and rain | Multipoint connection — pair with two devices simultaneously
,"Boat Airdopes Plus 311, Glass Design, ENx Tech, Fast Charge, 50 Hrs Battery, Stream Ad Free Music via App Support Bluetooth Earbuds, TWS Ear Buds Wireless Earphones with mic (Crimson Red)",Boat,999.0,3.7,5344.0,true wireless earbuds,enhanced_scrape,,,50.0,,,,,,0.0,,,0.0,0.0,0.0,0.0,1.0,0.0,,,India,,,,0,0,0,0,0,0.0,B0DZXX6SKP,Imagine Marketing Ltd,"Long 50H battery life for extended listening | Fast charging — minimal downtime between uses | Popular choice with 5,344+ reviews"
,"Boat Airdopes Plus 311, Glass Design, ENx Tech, Fast Charge, 50 Hrs Battery, Stream Ad Free Music via App Support Bluetooth Earbuds, TWS Ear Buds Wireless Earphones with mic (Ash Grey)",Boat,999.0,3.7,5344.0,true wireless earbuds,enhanced_scrape,,,50.0,,,,,,0.0,,,0.0,0.0,0.0,0.0,1.0,0.0,,,India,,,,0,0,0,0,0,0.0,B0DZXT72RY,Imagine Marketing Ltd,"Long 50H battery life for extended listening | Fast charging — minimal downtime between uses | Popular choice with 5,344+ reviews"
,"Bouncefit Bluetooth Wireless Mangentic On/Off Neckband, 40 Hours Continuous Playback Battery, Fast Charge, IPX7, Low Latency, Active Noise Cancellation, Earbuds with Mic Earphones (Black)",Bouncefit,346.0,3.5,401.0,true wireless earbuds,enhanced_scrape,,,40.0,,,,,IPX7,1.0,,7.0,0.0,0.0,0.0,0.0,1.0,0.0,,,India,,,,1,0,0,0,0,1.0,B0F4NDZ2VC,Bouncefit,Long 40H battery life for extended listening | Active Noise Cancellation for immersive listening | Fast charging — minimal downtime between uses | IP7 water resistance — safe for workouts and rain
,Deeliance Wireless Earbuds Bluetooth 5.1 TWS Earphones Full Touch Control Headphones Built-in Microphone Immersive Sound Quality Ensure Fast Stable & Connection Smart LED Headset Sports Bud,Deeliance,279.0,5.0,1.0,true wireless earbuds,enhanced_scrape,,,,,,5.1,,,1.0,,,0.0,0.0,1.0,0.0,0.0,0.0,,,India,,,,0,0,0,0,0,0.0,B0GF29H2SZ,Deeliance,Active Noise Cancellation for immersive listening | Highly rated 5.0/5 by customers
,Drumstone TopRated 𝟏𝟓𝐘𝐫 𝐖𝐚𝐫𝐫𝐚𝐧𝐭𝐲 Bluetooth Noise Canceling Earpiece with Mic Wireless Headset for Calls & Music for Android & iOS Devices Earphone | Ideal Gift for Professionals,Drumstone,1449.0,5.0,3.0,unknown,enhanced_scrape,,,,,,,,,1.0,,,0.0,0.0,0.0,0.0,0.0,0.0,,,India,,,,0,0,0,0,0,0.0,B0G62TWV4D,Drumstone,Active Noise Cancellation for immersive listening | Highly rated 5.0/5 by customers
,"EDYELL Bluetooth in Ear Earphones with Earhooks, Wireless Earbuds with Noise Cancelling Mic, 50H Playback, BT5.3 Headphones Touch Control, IPX5 Waterproof Fitness Headset for Sports Running,V5",EDYELL,1899.0,3.9,552.0,true wireless earbuds,enhanced_scrape,,,50.0,,,5.3,,IPX5,1.0,,5.0,0.0,0.0,1.0,0.0,0.0,0.0,,,China,,,,0,0,0,0,0,1.0,B0D2PZB9M3,EDYELL,"Long 50H battery life for extended listening | Active Noise Cancellation for immersive listening | IP5 water resistance — safe for workouts and rain | Latest Bluetooth v5.3 for stable, efficient connection"
,"Fire-Boltt Aero TWS Earbuds Custom EQ, Wireless Bluetooth 5.4, Music & App Support, 50H Playtime, Fast Charging Case, 50ms Low Latency for Gaming, Touch Controls, IPX4 Waterproof, Clear Calls - Blue",Fire-Boltt,699.0,3.8,9306.0,true wireless earbuds,enhanced_scrape,,,50.0,,,5.4,,IPX4,0.0,,4.0,0.0,0.0,1.0,0.0,1.0,0.0,,50.0,India,,,,1,1,0,0,1,1.0,B0FVS5PRCH,Boltt Sports Technologies,"Long 50H battery life for extended listening | Ultra-low 50ms latency — ideal for gaming and video | Fast charging — minimal downtime between uses | IP4 water resistance — safe for workouts and rain | Latest Bluetooth v5.4 for stable, efficient connection | Popular choice with 9,306+ reviews"
,"Fire-Boltt Newly Launched Aero Fit TWS Earbuds with Custom EQ, Bluetooth 5.4 Wireless Earphones, 50H Playtime, Fast Charging Case, 50ms Low Latency Gaming & Touch Controls Black",Fire-Boltt,849.0,3.8,189.0,true wireless earbuds,enhanced_scrape,,,50.0,,,5.4,,,0.0,,,0.0,0.0,1.0,0.0,1.0,0.0,,50.0,India,,,,1,1,0,0,1,0.0,B0GHQHX1RK,Boltt Sports Technologies,"Long 50H battery life for extended listening | Ultra-low 50ms latency — ideal for gaming and video | Fast charging — minimal downtime between uses | Latest Bluetooth v5.4 for stable, efficient connection"
,Fire-Boltt Newly Launched Aero Drift TWS Earbuds Custom EQ Wireless Bluetooth 5.4 Music & App Support 50H Playtime Battery Display Fast Charging Case 50ms Low Latency Touch Controls White,Fire-Boltt,899.0,3.8,1661.0,true wireless earbuds,enhanced_scrape,,,50.0,,,5.4,,,0.0,,,0.0,0.0,1.0,0.0,1.0,0.0,,50.0,India,,,,1,0,0,0,1,0.0,B0GHQYJ6DX,Boltt Sports Technologies,"Long 50H battery life for extended listening | Ultra-low 50ms latency — ideal for gaming and video | Fast charging — minimal downtime between uses | Latest Bluetooth v5.4 for stable, efficient connection | Popular choice with 1,661+ reviews"
,"Fire-Boltt Aero Clip OWS Earbud w/Clip-On Fit, Custom EQ, Wireless Bluetooth TWS,50H Playtime, 50ms Low Latency, Display on Charging Case, App Support, Touch Controls, Gaming & Music - Midnight Black",Fire-Boltt,1499.0,3.7,114.0,true wireless earbuds,enhanced_scrape,,,50.0,,,,,,0.0,,,0.0,0.0,1.0,0.0,0.0,0.0,,50.0,India,,,,1,1,0,0,1,0.0,B0GHQHZRJT,Boltt Sports Technologies,Long 50H battery life for extended listening | Ultra-low 50ms latency — ideal for gaming and video
,"Fire-BolttAero Shadow TWS Earbuds Custom EQ, RGB Lights, Wireless Bluetooth 5.4, Music & App Support, 50H Playtime, Fast Charging Case, 50ms Low Latency for Gaming, Touch Controls - Flame Red",Fire-BolttAero,799.0,4.2,80.0,true wireless earbuds,enhanced_scrape,,,50.0,,,5.4,,,0.0,,,0.0,0.0,1.0,0.0,1.0,0.0,,50.0,India,,,,1,1,0,0,1,0.0,B0GHQD8KP2,Boltt Sports Technologies,"Long 50H battery life for extended listening | Ultra-low 50ms latency — ideal for gaming and video | Fast charging — minimal downtime between uses | Latest Bluetooth v5.4 for stable, efficient connection | Highly rated 4.2/5 by customers"
,"GOBOULT Y1 v2.0 Ear Buds Wireless with 60H Playtime, Zen Quad Mic ENC, 45ms Low Latency, Touch Contorl, Dual Device Pairing, Bluetooth 6.0, 13mm Bass Driver Earbud TWS Wireless Earphone (Blue Teal)",GOBOULT,1199.0,4.1,98.0,true wireless earbuds,enhanced_scrape,,,60.0,,,6.0,,,0.0,,,0.0,0.0,0.0,0.0,0.0,1.0,,45.0,India,,,,1,0,0,0,1,0.0,B0GSQXFNMF,Boult Audio,"Exceptional 60H battery — great for all-day use | Ultra-low 45ms latency — ideal for gaming and video | Latest Bluetooth v6.0 for stable, efficient connection | Multipoint connection — pair with two devices simultaneously | Well-rated at 4.1/5 stars"
,"GOBOULT Astra Truly Wireless in Ear Earbuds with 48H Playtime, Built-in App Support, 45ms Low Latency Gaming, 4 Mics ENC, Breathing LEDs,13mm Bass Drivers, TWS Ear Buds (Smoky Metal)",GOBOULT,1299.0,4.1,795.0,true wireless earbuds,enhanced_scrape,,,48.0,,,,4 mics,,0.0,,,0.0,0.0,0.0,0.0,0.0,0.0,,45.0,India,,,,1,1,0,0,1,0.0,B0CQ4NJB5G,Boult Audio,Long 48H battery life for extended listening | Ultra-low 45ms latency — ideal for gaming and video | 4-mic array with ENC for crystal-clear calls | Well-rated at 4.1/5 stars
,"GOBOULT Mustang Sprint in Ear Earbuds with 60H Playtime, Amp App Support, 32dB Active Noise Cancellation, Quad Mic ENC, Dual Device Pairing, 10mm Driver, BTv 6.0 Wireless (Turbo Yellow)",GOBOULT,1799.0,4.1,277.0,true wireless earbuds,enhanced_scrape,,,60.0,,10.0,,,,1.0,,,0.0,0.0,0.0,0.0,0.0,1.0,,,India,,,,1,0,0,0,0,0.0,B0GM113PJQ,Boult Audio,"Exceptional 60H battery — great for all-day use | Active Noise Cancellation for immersive listening | 10mm driver for rich, detailed sound | Multipoint connection — pair with two devices simultaneously | Well-rated at 4.1/5 stars"
,"GOBOULT Mustang Torq Wireless in Ear Earbuds with 60H Playtime, App Support, Quad Mic ENC, 45ms Low Latency, 13mm Driver, Breathing LEDs, Made in India Ear Buds Wireless (Green)",GOBOULT,1799.0,4.0,13365.0,true wireless earbuds,enhanced_scrape,,,60.0,,13.0,,,,0.0,,,0.0,0.0,0.0,0.0,0.0,0.0,,45.0,India,,,,1,0,0,0,1,0.0,B0GK1GSRLJ,Boult Audio,"Exceptional 60H battery — great for all-day use | Ultra-low 45ms latency — ideal for gaming and video | 13mm driver for rich, detailed sound | Well-rated at 4.0/5 stars | Trusted by 13,365+ buyers"
,"GOBOULT Astra Neo Bluetooth in Ear Earbuds with 70H Playtime, 40mm Bass Driver, Zen ENC Mic, Type-C Fast Charging, 4EQ Modes, Bluetooth 5.4, Low Latency Gaming, Wireless Earbuds (White)",GOBOULT,1099.0,4.0,1536.0,true wireless earbuds,enhanced_scrape,,,70.0,,,5.4,,,0.0,,,0.0,0.0,0.0,0.0,1.0,0.0,,,India,,,4.0,1,1,0,0,0,0.0,B0DZ12NCD7,Boult Audio,"Exceptional 70H battery — great for all-day use | Fast charging — minimal downtime between uses | Latest Bluetooth v5.4 for stable, efficient connection | Well-rated at 4.0/5 stars | Popular choice with 1,536+ reviews"
,"GOBOULT Z40 Pro v2.0 in Ear Earbuds with 100H Playtime, Amp App Support, Active Noise Cancellation, Quad Mic ENC, Dual Device Pairing, 13mm Driver, Bluetooth 5.4 Wireless (Indigo Rust)",GOBOULT,1499.0,3.9,492.0,true wireless earbuds,enhanced_scrape,,,100.0,,13.0,5.4,,,1.0,,,0.0,0.0,0.0,0.0,0.0,1.0,,,India,,,,1,0,0,0,0,0.0,B0GRV5S7DW,Boult Audio,"Exceptional 100H battery — great for all-day use | Active Noise Cancellation for immersive listening | 13mm driver for rich, detailed sound | Latest Bluetooth v5.4 for stable, efficient connection | Multipoint connection — pair with two devices simultaneously"
,"GOBOULT Z60 Made in India Ear Buds Wireless with 60H Playtime, 4 ENC Mics Clear Calling, 50ms Low Latency Gaming, 13mm Bass Driver Earbuds Bluetooth Wireless Earphones (Spring Green)",GOBOULT,899.0,3.9,1804.0,true wireless earbuds,enhanced_scrape,,,60.0,,,,,,0.0,,,0.0,0.0,0.0,0.0,0.0,0.0,,50.0,India,,,,1,1,0,0,1,0.0,B0CBV22Q52,Boult Audio,"Exceptional 60H battery — great for all-day use | Ultra-low 50ms latency — ideal for gaming and video | Popular choice with 1,804+ reviews"
,"GOBOULT Y1 Ear Buds Wireless with 50H Playtime, Clear Calling ENC Mic, Low Latency Gaming, Made in India, 10mm Bass Drivers Earbuds Buds TWS Bluetooth (Green)",GOBOULT,699.0,3.9,215.0,true wireless earbuds,enhanced_scrape,,,50.0,,,,,,0.0,,,0.0,0.0,0.0,0.0,0.0,0.0,,,India,,,,1,1,0,0,0,0.0,B0G51YJ53N,Boult Audio,Long 50H battery life for extended listening
,"GOBOULT Z20 Made in India Bluetooth Ear Buds Wireless 51H Playtime, Clear Calling ENC Mic, Low Latency Gaming, 10mm Drivers Earbuds Buds Bluetooth Wireless Earphones (Pine Green)",GOBOULT,999.0,3.9,2221.0,true wireless earbuds,enhanced_scrape,,,51.0,,10.0,,,,0.0,,,0.0,0.0,0.0,0.0,0.0,0.0,,,India,,,,1,1,0,0,0,0.0,B0DSG8SNXH,Boult Audio,"Long 51H battery life for extended listening | 10mm driver for rich, detailed sound | Popular choice with 2,221+ reviews"
,"GOBOULT K40 True Wireless in Ear Earbuds with 48H Playtime, Clear Calling 4 Mics, 45ms Low Latency Gaming, 13mm Bass Drivers, Type-C Fast Charging, Bluetooth 5.3 Ear Buds (Ivory White)",GOBOULT,1099.0,3.9,8212.0,true wireless earbuds,enhanced_scrape,,,48.0,,,5.3,4 mics,,0.0,,,0.0,0.0,0.0,0.0,1.0,0.0,,45.0,India,,,,1,1,0,0,1,0.0,B0CTCX6CHW,Boult Audio,"Long 48H battery life for extended listening | Ultra-low 45ms latency — ideal for gaming and video | Fast charging — minimal downtime between uses | 4-mic array with ENC for crystal-clear calls | Latest Bluetooth v5.3 for stable, efficient connection | Popular choice with 8,212+ reviews"
,"GOBOULT Made in India K10 Ear Buds Wireless with 50H Playtime, 4 Mics Clear Calling, 45ms Low Latency Gaming, 10mm Bass Drivers Earbuds Buds Bluetooth Wireless Earphones (Ice Blue)",GOBOULT,799.0,3.9,3482.0,true wireless earbuds,enhanced_scrape,,,50.0,,,,4 mics,,0.0,,,0.0,0.0,0.0,0.0,0.0,0.0,,45.0,India,,,,1,1,0,0,1,0.0,B0DFMHM9CM,Boult Audio,"Long 50H battery life for extended listening | Ultra-low 45ms latency — ideal for gaming and video | 4-mic array with ENC for crystal-clear calls | Popular choice with 3,482+ reviews"
,"GOBOULT W20 Truly Wireless in Ear Earbuds with 40H Playtime, Zen™ ENC Mic, 45ms Low Latency, 13mm Bass Drivers, Type-C Fast Charging, Touch Control, IPX5 Ear Buds TWS (Glacier Blue)",GOBOULT,799.0,3.9,15048.0,true wireless earbuds,enhanced_scrape,,,40.0,,,,,IPX5,0.0,,5.0,0.0,0.0,1.0,0.0,1.0,0.0,,45.0,India,,,,1,0,0,0,1,1.0,B0D3R1JQ7D,Boult Audio,"Long 40H battery life for extended listening | Ultra-low 45ms latency — ideal for gaming and video | Fast charging — minimal downtime between uses | IP5 water resistance — safe for workouts and rain | Trusted by 15,048+ buyers"
,"GOBOULT Z40 Pro with 100H Playtime, Zen Quad Mic ENC, 45ms Low Latency Gaming, Premium Rubber Grip Case, 13mm Bass Drivers, BT 5.3, TWS Truly Wireless in Ear Earbuds (Lavender)",GOBOULT,1099.0,3.8,44096.0,true wireless earbuds,enhanced_scrape,,,100.0,,,5.3,,,0.0,,,0.0,0.0,0.0,0.0,0.0,0.0,,45.0,India,,,,1,1,0,0,1,0.0,B0CHVWYZV8,Boult Audio,"Exceptional 100H battery — great for all-day use | Ultra-low 45ms latency — ideal for gaming and video | Latest Bluetooth v5.3 for stable, efficient connection | Trusted by 44,096+ buyers"
,"GOBOULT Y1 Pro Ear Buds Wireless 60H Playtime, 4 Mics Calling, 45ms Low Latency Gaming, Made in India,13mm Bass Driver Earbuds Buds TWS Bluetooth Wireless Earphone (Powder Blue)",GOBOULT,899.0,3.7,347.0,true wireless earbuds,enhanced_scrape,,,60.0,,,,4 mics,,0.0,,,0.0,0.0,0.0,0.0,0.0,0.0,,45.0,India,,,,1,1,0,0,1,0.0,B0DMM1H92H,Boult Audio,Exceptional 60H battery — great for all-day use | Ultra-low 45ms latency — ideal for gaming and video | 4-mic array with ENC for crystal-clear calls
,"GOBOULT Klarity 4 ANC in-Ear Truly Wireless Earbuds with 35dB Active Noise Cancellation, 60H Playtime, 4 Mics Calling, 45ms Low Latency, 10mm Driver, Type-C Fast Charging (Jet Black)",GOBOULT,999.0,3.3,94.0,true wireless earbuds,enhanced_scrape,,,60.0,,10.0,,4 mics,,1.0,,,0.0,0.0,0.0,0.0,1.0,0.0,,45.0,India,,,,1,0,0,0,1,0.0,B0F9L6VF7G,Boult Audio,"Exceptional 60H battery — great for all-day use | Active Noise Cancellation for immersive listening | Ultra-low 45ms latency — ideal for gaming and video | Fast charging — minimal downtime between uses | 4-mic array with ENC for crystal-clear calls | 10mm driver for rich, detailed sound"
,"HAMMER Ultra Pods True Wireless Earbuds with in-Built Mic, 100H Standby Time, 1H Charging USB Type-C, 13mm Dynamic Drivers, 50H Playtime, BT v6.0 Connectivity, IPX5 Water Resistant (Beige)",HAMMER,579.0,3.7,945.0,true wireless earbuds,enhanced_scrape,,,100.0,,,6.0,,IPX5,0.0,,5.0,1.0,0.0,0.0,0.0,0.0,0.0,,,India,1.0,,,0,0,0,0,0,1.0,B0FZD7ZJGD,Hammer Lifestyle,"Exceptional 100H battery — great for all-day use | IP5 water resistance — safe for workouts and rain | Latest Bluetooth v6.0 for stable, efficient connection"
,"HAMMER Screen TWS Earbuds Wireless with 13mm Drivers, ANC Ear Buds 32dB, up to 50H Playtime TWS Ear Buds, Type-C Fast Charging, BT v5.4, True Wireless Earbuds Bluetooth,Transparency & EQ Mode (White)",HAMMER,1499.0,3.6,1082.0,true wireless earbuds,enhanced_scrape,,,50.0,,13.0,5.4,,,1.0,,,0.0,0.0,0.0,0.0,1.0,0.0,,,India,,,,1,0,0,0,0,0.0,B0D2J4FT99,Hammer Lifestyle,"Long 50H battery life for extended listening | Active Noise Cancellation for immersive listening | Fast charging — minimal downtime between uses | 13mm driver for rich, detailed sound | Latest Bluetooth v5.4 for stable, efficient connection | Popular choice with 1,082+ reviews"
,"HAMMER New Launch Ultra Pods TWS Wireless Bluetooth Ear buds, Inbuilt Mic, 100H Standby Time, Earbuds with 30H Playtime, USB Type-C,13mm Dynamic Drivers, IPX5 Water Resistant Bluetooth Earphones(Blue)",HAMMER,599.0,3.5,751.0,true wireless earbuds,enhanced_scrape,,,100.0,,,,,IPX5,0.0,,5.0,1.0,0.0,0.0,0.0,0.0,0.0,,,India,,,,0,0,0,0,0,1.0,B0D7C56BJN,Hammer Lifestyle,Exceptional 100H battery — great for all-day use | IP5 water resistance — safe for workouts and rain
,HP H200 Wireless Headset,HP,1306.0,4.0,1421.0,unknown,enhanced_scrape,,,,,,,,,0.0,,,0.0,0.0,0.0,0.0,0.0,0.0,,,USA,,,,0,0,0,0,0,0.0,B0DHKJ5HWL,HP Inc.,"Well-rated at 4.0/5 stars | Popular choice with 1,421+ reviews"
,"Humble® Wireless Bluetooth Earbuds with Noise Cancellation, 24H Playtime, Touch Controls, Deep Bass Stereo Sound, Fast Pairing TWS Earphones with Voice Assistant Support – Black",Humble®,798.0,4.0,59.0,true wireless earbuds,enhanced_scrape,,,24.0,,,,,,1.0,,,0.0,0.0,1.0,1.0,0.0,0.0,,,India,,,,0,0,0,0,0,0.0,B0G7221VDX,Humble®,Decent 24H playtime for daily commutes | Active Noise Cancellation for immersive listening | Well-rated at 4.0/5 stars
,"Kratos TW02 Ear Buds Wireless with 30H Playtime, Noise Isolation & Clear Calls, Bluetooth Earbuds with Voice Assistant, Ear Buds with Bluetooth V 5.3 & with Type C Fast Charging, IPX5 TWS Earphones",Kratos,499.0,4.4,218.0,true wireless earbuds,enhanced_scrape,,,30.0,,,5.3,,IPX5,0.0,,5.0,0.0,0.0,0.0,1.0,1.0,0.0,,,India,,,,0,0,0,0,0,1.0,B0GCT3DKWB,Kratos India,Decent 30H playtime for daily commutes | Fast charging — minimal downtime between uses | IP5 water resistance — safe for workouts and rain | Highly rated 4.4/5 by customers
,"Kratos N1 Neckband Bluetooth Headphones with 30 Hours Playtime with 13mm Drivers, Rich Music Experience, Type C Fast Charging, Neckband Earphones with Voice Assistant & IPX4 Water Resistant",Kratos,398.0,4.0,1168.0,over-ear headphone,enhanced_scrape,,,30.0,,13.0,,,IPX4,0.0,,4.0,0.0,0.0,0.0,1.0,1.0,0.0,,,India,,,,1,0,0,0,0,1.0,B0G2SPF2W1,Kratos India,"Decent 30H playtime for daily commutes | Fast charging — minimal downtime between uses | IP4 water resistance — safe for workouts and rain | 13mm driver for rich, detailed sound | Well-rated at 4.0/5 stars | Popular choice with 1,168+ reviews"
,"Kratos N4 Bluetooth Neckband with 52H Playtime, Deep Bass, Stereo Sound, HD Calls, Magnetic Earbuds, Type-C Fast Charging, Rich Audio, Hollow Switch for Comfort & Style",Kratos,349.0,3.6,2001.0,true wireless earbuds,enhanced_scrape,,,52.0,,,,,,0.0,,,0.0,0.0,0.0,0.0,1.0,0.0,,,India,,,,0,0,0,0,0,0.0,B0FCCH3KMZ,Kratos India,"Long 52H battery life for extended listening | Fast charging — minimal downtime between uses | Popular choice with 2,001+ reviews"
,"Kratos Cube Ear Buds Wireless with 30H Playtime, Noise Isolation & Clear Calls, Bluetooth Earbuds with Voice Assistant, Ear Buds with Bluetooth V 5.3 & with Type C Fast Charging, IPX4 TWS Earphones",Kratos,499.0,3.6,470.0,true wireless earbuds,enhanced_scrape,,,30.0,,,5.3,,IPX4,0.0,,4.0,0.0,0.0,0.0,1.0,1.0,0.0,,,India,,,,0,0,0,0,0,1.0,B0FSDYHR92,Kratos India,Decent 30H playtime for daily commutes | Fast charging — minimal downtime between uses | IP4 water resistance — safe for workouts and rain
,"Luxaro Mart UltraPods Max True Wireless Earbuds with Bluetooth 5.3, Enhanced Sound Quality, Touch Control, Long Lasting, Noise Cancellation & Comfortable Fit (Black)",Luxaro,277.0,5.0,1.0,true wireless earbuds,enhanced_scrape,,,,,,5.3,,,1.0,,,0.0,0.0,1.0,0.0,0.0,0.0,,,China,,,,0,0,0,0,0,0.0,B0GN2MYWGC,Luxaro,"Active Noise Cancellation for immersive listening | Latest Bluetooth v5.3 for stable, efficient connection | Highly rated 5.0/5 by customers"
,"Luxaro Mart UltraPods Max True Wireless Earbuds with Bluetooth 5.3, Enhanced Sound Quality, Touch Control,Battery Life, Noise Cancellation & Comfortable Fit",Luxaro,277.0,2.0,2.0,true wireless earbuds,enhanced_scrape,,,,,,5.3,,,1.0,,,0.0,0.0,1.0,0.0,0.0,0.0,,,China,,,,0,0,0,0,0,0.0,B0GHK4DS12,Luxaro,"Active Noise Cancellation for immersive listening | Latest Bluetooth v5.3 for stable, efficient connection"
,"M19 Wireless Bluetooth Earbuds with LED Power Display, Wireless Charging Case, Touch Control, Crystal Clear Audio",M19,309.0,3.3,4.0,true wireless earbuds,enhanced_scrape,,,,,,,,,0.0,,,0.0,0.0,1.0,0.0,0.0,0.0,,,China,,,,0,0,0,0,0,0.0,B0GSBY5874,M19,Affordable wireless earbuds with Bluetooth connectivity
